[
  {
    "event_id": "p001-01",
    "trace_id": "trace-hier-001",
    "span_id": "span-p1",
    "parent_span_id": null,
    "session_id": "sess-1",
    "agent_id": "primary-agent",
    "role": "primary",
    "depth": 0,
    "event_type": "plan_step",
    "symbol": "plan",
    "raw_symbol": "plan_step",
    "attributes": {
      "param_schema_hash": "e3b0c44298fc1c149afbf4c8996fb92427ae41e4649b934ca495991b7852b855",
      "status": "success"
    },
    "timestamp": "2026-09-07T10:00:00Z",
    "framework": "custom",
    "framework_schema_version": "1.0",
    "adapter_version": "1.0",
    "sequence_no": 1,
    "schema_version": "1.0",
    "status": "success"
  },
  {
    "event_id": "p001-02",
    "trace_id": "trace-hier-001",
    "span_id": "span-p1",
    "parent_span_id": null,
    "session_id": "sess-1",
    "agent_id": "primary-agent",
    "role": "primary",
    "depth": 0,
    "event_type": "tool_call",
    "symbol": "web_search",
    "raw_symbol": "web_search",
    "attributes": {
      "param_schema_hash": "e3b0c44298fc1c149afbf4c8996fb92427ae41e4649b934ca495991b7852b855",
      "status": "success"
    },
    "timestamp": "2026-09-07T10:00:01Z",
    "framework": "custom",
    "framework_schema_version": "1.0",
    "adapter_version": "1.0",
    "sequence_no": 2,
    "schema_version": "1.0",
    "status": "success"
  },
  {
    "event_id": "p001-03",
    "trace_id": "trace-hier-001",
    "span_id": "span-p1",
    "parent_span_id": null,
    "session_id": "sess-1",
    "agent_id": "primary-agent",
    "role": "primary",
    "depth": 0,
    "event_type": "delegate",
    "symbol": "delegate(reviewer)",
    "raw_symbol": "delegate(reviewer)",
    "attributes": {
      "param_schema_hash": "e3b0c44298fc1c149afbf4c8996fb92427ae41e4649b934ca495991b7852b855",
      "status": "success"
    },
    "timestamp": "2026-09-07T10:00:02Z",
    "framework": "custom",
    "framework_schema_version": "1.0",
    "adapter_version": "1.0",
    "sequence_no": 3,
    "schema_version": "1.0",
    "status": "success"
  },
  {
    "event_id": "c001-01",
    "trace_id": "trace-hier-001",
    "span_id": "span-c1",
    "parent_span_id": "span-p1",
    "session_id": "sess-1",
    "agent_id": "reviewer-agent-01",
    "role": "reviewer",
    "depth": 1,
    "event_type": "tool_call",
    "symbol": "receive",
    "raw_symbol": "receive",
    "attributes": {
      "param_schema_hash": "e3b0c44298fc1c149afbf4c8996fb92427ae41e4649b934ca495991b7852b855",
      "status": "success"
    },
    "timestamp": "2026-09-07T10:00:03Z",
    "framework": "custom",
    "framework_schema_version": "1.0",
    "adapter_version": "1.0",
    "sequence_no": 4,
    "schema_version": "1.0",
    "status": "success"
  },
  {
    "event_id": "c001-02",
    "trace_id": "trace-hier-001",
    "span_id": "span-c1",
    "parent_span_id": "span-p1",
    "session_id": "sess-1",
    "agent_id": "reviewer-agent-01",
    "role": "reviewer",
    "depth": 1,
    "event_type": "tool_call",
    "symbol": "inspect",
    "raw_symbol": "inspect",
    "attributes": {
      "param_schema_hash": "e3b0c44298fc1c149afbf4c8996fb92427ae41e4649b934ca495991b7852b855",
      "status": "success"
    },
    "timestamp": "2026-09-07T10:00:04Z",
    "framework": "custom",
    "framework_schema_version": "1.0",
    "adapter_version": "1.0",
    "sequence_no": 5,
    "schema_version": "1.0",
    "status": "success"
  },
  {
    "event_id": "c001-03",
    "trace_id": "trace-hier-001",
    "span_id": "span-c1",
    "parent_span_id": "span-p1",
    "session_id": "sess-1",
    "agent_id": "reviewer-agent-01",
    "role": "reviewer",
    "depth": 1,
    "event_type": "tool_call",
    "symbol": "tool_call",
    "raw_symbol": "tool_call",
    "attributes": {
      "param_schema_hash": "e3b0c44298fc1c149afbf4c8996fb92427ae41e4649b934ca495991b7852b855",
      "status": "success"
    },
    "timestamp": "2026-09-07T10:00:05Z",
    "framework": "custom",
    "framework_schema_version": "1.0",
    "adapter_version": "1.0",
    "sequence_no": 6,
    "schema_version": "1.0",
    "status": "success"
  },
  {
    "event_id": "c001-04",
    "trace_id": "trace-hier-001",
    "span_id": "span-c1",
    "parent_span_id": "span-p1",
    "session_id": "sess-1",
    "agent_id": "reviewer-agent-01",
    "role": "reviewer",
    "depth": 1,
    "event_type": "terminate",
    "symbol": "return",
    "raw_symbol": "return",
    "attributes": {
      "param_schema_hash": "e3b0c44298fc1c149afbf4c8996fb92427ae41e4649b934ca495991b7852b855",
      "status": "success"
    },
    "timestamp": "2026-09-07T10:00:06Z",
    "framework": "custom",
    "framework_schema_version": "1.0",
    "adapter_version": "1.0",
    "sequence_no": 7,
    "schema_version": "1.0",
    "status": "success"
  },
  {
    "event_id": "p001-04",
    "trace_id": "trace-hier-001",
    "span_id": "span-p1",
    "parent_span_id": null,
    "session_id": "sess-1",
    "agent_id": "primary-agent",
    "role": "primary",
    "depth": 0,
    "event_type": "tool_call",
    "symbol": "merge",
    "raw_symbol": "merge",
    "attributes": {
      "param_schema_hash": "e3b0c44298fc1c149afbf4c8996fb92427ae41e4649b934ca495991b7852b855",
      "status": "success"
    },
    "timestamp": "2026-09-07T10:00:07Z",
    "framework": "custom",
    "framework_schema_version": "1.0",
    "adapter_version": "1.0",
    "sequence_no": 8,
    "schema_version": "1.0",
    "status": "success"
  },
  {
    "event_id": "p001-05",
    "trace_id": "trace-hier-001",
    "span_id": "span-p1",
    "parent_span_id": null,
    "session_id": "sess-1",
    "agent_id": "primary-agent",
    "role": "primary",
    "depth": 0,
    "event_type": "terminate",
    "symbol": "terminate",
    "raw_symbol": "terminate",
    "attributes": {
      "param_schema_hash": "e3b0c44298fc1c149afbf4c8996fb92427ae41e4649b934ca495991b7852b855",
      "status": "success"
    },
    "timestamp": "2026-09-07T10:00:08Z",
    "framework": "custom",
    "framework_schema_version": "1.0",
    "adapter_version": "1.0",
    "sequence_no": 9,
    "schema_version": "1.0",
    "status": "success"
  }
]